{
  "$schema": "https://maw.soulbrews.studio/schema/plugin.json",
  "name": "oracle-skills",
  "version": "0.1.0",
  "description": "Wraps the arra-oracle-skills CLI — install Oracle skills to Claude Code, OpenCode, Cursor, and 11+ AI coding agents.",
  "author": "Soul-Brews-Studio",
  "license": "MIT",
  "homepage": "https://github.com/Soul-Brews-Studio/maw-plugin-registry",
  "sdk": "^1.0.0",
  "schemaVersion": 1,
  "entry": "./index.ts"
}
