{
  "$schema": "https://maw.soulbrews.studio/schema/plugin.json",
  "name": "dream",
  "version": "0.1.0",
  "description": "Cross-repo pattern discovery — finds pains, plans, gains, lost work, and feelings across all repositories.",
  "author": "Soul-Brews-Studio",
  "license": "BUSL-1.1",
  "homepage": "https://github.com/Soul-Brews-Studio/maw-plugin-registry",
  "sdk": "^1.0.0",
  "schemaVersion": 1,
  "entry": "./index.ts"
}
